<?xml version="1.0" encoding="UTF-8"?>
<customers xmlns:xsi="http://www.w3.org/2001/XMLSchema-instance" xsi:noNamespaceSchemaLocation="file:///C:/Workspaces/JavaEE/Training/XmlProcessing/src/customers.xsd">
	<customer id="100">
		<age>29</age>
		<name>Customer 1</name>
	</customer>
	<customer id="200">
		<age>39</age>
		<name>Customer 2</name>
	</customer>
	<customer id="300">
		<age>43</age>
		<name>Customer 3</name>
	</customer>
</customers>
